<?xml version="1.0" encoding="UTF-8"?>

<Fesztivál_DIZ4VX xmlns:xs="http://www.w3.org/2001/XMLSchema-instance" xs:noNamespaceSchemaLocation="XMLSchema_DIZ4VX.xsd">
    <fesztivál feszkód="1">
        <név>Strand Fesztivál</név>
        <helyszín>Zamádi</helyszín>
        <év>2023</év>
    </fesztivál>
    <fesztivál feszkód="2">
        <név>Kocsonyafesztivál</név>
        <helyszín>Miskolc</helyszín>
        <év>2023</év>
    </fesztivál>

    <tulajdonos tkód="11" fesztivál="1">
        <név>Sziget Kulturális Menedzser Iroda Zártkörűen Működő Részvénytársaság</név>
        <adószám>12345678-8-69</adószám>
        <alapítás>2000</alapítás>
        <bevétel>46868000</bevétel>
    </tulajdonos>
    <tulajdonos tkód="12" fesztivál="2">
        <név>Miskolc Város Önkormányzata</név>
        <adószám>112345678-5-55</adószám>
        <alapítás>1990</alapítás>
        <bevétel>97476127</bevétel>
    </tulajdonos>

    <fellépő felkód="21" fesztivál="1">
        <név>Ákos</név>
        <ország>Magyarország</ország>
        <díj>500000</díj>
    </fellépő>
    <fellépő felkód="22" fesztivál="2">
        <név>Tiesto</név>
        <ország>Hollandia</ország>
        <díj>800000</díj>
    </fellépő>

    <bár bkód="31" fesztivál="1">
        <név>Fit-Nes</név>
        <ital>vadász</ital>
        <ital>pálinka</ital>
        <ital>bor</ital>
        <ital>rum</ital>
        <cég>Vicc kft.</cég>
    </bár>
    <bár bkód="32" fesztivál="2">
        <név>Korozó</név>
        <ital>sör</ital>
        <ital>bor</ital>
        <ital>házmester</ital>
        <ital>pálinka</ital>
        <cég>Korozó kft.</cég>
    </bár>

    <alkalmazott akód="41" munkahely="31">
        <név>Farkas Cintia</név>
        <muszak>8-20</muszak>
        <fizetés>200000</fizetés>
    </alkalmazott>
    <alkalmazott akód="42" munkahely="32">
        <név>Bukta Laura</név>
        <muszak>20-4</muszak>
        <muszak>8-12</muszak>
        <fizetés>300000</fizetés>
    </alkalmazott>

    <résztvevő rkód="51" fesztivál="1">
        <név>Badány gábor</név>
        <diákigazolvány>123456789</diákigazolvány>
        <lakcím>
            <település>Miskolc</település>
            <utca>Alma</utca>
            <házszám>10</házszám>
        </lakcím>
    </résztvevő>
    <résztvevő rkód="52" fesztivál="2">
        <név>Farkas Balázs</név>
        <lakcím>
            <település>Budapest</település>
            <utca>Köd</utca>
            <házszám>1</házszám>
        </lakcím>
    </résztvevő>

    <nyelvtudás nykód="61">
        <nyelv>angol</nyelv>
        <szint>B2</szint>
    </nyelvtudás>
    <nyelvtudás nykód="62">
        <nyelv>német</nyelv>
        <szint>B2</szint>
    </nyelvtudás>

    <közvélemény kkód="71" megkérdezett="51" nyelvtudás="61">
        <kérdező>Forgács Beatrix</kérdező>
    </közvélemény>
    <közvélemény kkód="72" megkérdezett="52" nyelvtudás="62">
        <kérdező>Forgács Beatrix</kérdező>
    </közvélemény>
</Fesztivál_DIZ4VX>